{
  "version": 3,
  "meta": {
    "name": "Nicholas Ferguson",
    "email": "nick@atlascrew.dev",
    "phone": "727.266.8813",
    "location": "Tampa, FL (Remote)",
    "links": [
      { "label": "github", "url": "github.com/NickCrew" },
      { "label": "linkedin", "url": "linkedin.com/in/ncferguson" }
    ]
  },

  "vectors": [
    { "id": "security", "label": "Security Platform", "color": "#e74c3c" },
    { "id": "platform", "label": "Platform / DevEx", "color": "#2dd4a0" },
    { "id": "sre", "label": "SRE / Infrastructure", "color": "#3b9eff" },
    { "id": "build", "label": "Build / Release Engineering", "color": "#f39c12" },
    { "id": "leadership", "label": "Engineering Leadership", "color": "#a78bfa" }
  ],

  "target_lines": [
    {
      "id": "tl-security",
      "text": "Senior Platform Engineer | Edge Security | Rust / Python / eBPF",
      "vectors": { "security": "must" }
    },
    {
      "id": "tl-platform",
      "text": "Senior Platform Engineer | Internal Developer Platforms | Infrastructure as Product",
      "vectors": { "platform": "must", "sre": "strong" }
    },
    {
      "id": "tl-sre",
      "text": "Senior Platform Engineer | SRE | Fleet Management / Observability",
      "vectors": { "sre": "must" }
    },
    {
      "id": "tl-build",
      "text": "Senior Platform / Build Engineer | CI/CD / Cross-Platform Release Engineering",
      "vectors": { "build": "must" }
    },
    {
      "id": "tl-leadership",
      "text": "Engineering Leader | Platform Strategy | Developer Productivity",
      "vectors": { "leadership": "must" }
    }
  ],

  "profiles": [
    {
      "id": "profile-default",
      "text": "Platform engineer who treats infrastructure as a product. Delivered four production platforms in 11 months post-acquisition — an edge protection sensor that cut detection latency from seconds to sub-millisecond (4,400× improvement, 99.8% OWASP coverage), a fleet management and threat intelligence platform, an internal security tooling suite, and a Linux endpoint agent for the company's AI Firewall product. Previously built an internal developer platform shipping $50M/year in software across 6 target platforms. Track record of identifying architectural gaps, choosing the right technology for the constraint, and driving platforms from roadmap to production — then handing them off so others can own them.",
      "vectors": { "security": "must", "platform": "must", "sre": "strong", "leadership": "strong" }
    },
    {
      "id": "profile-security",
      "text": "Security platform engineer who builds detection and protection infrastructure at the edge. Architected an edge protection sensor that moved detection from cloud round-trips (1–10s latency) to inline processing at sub-millisecond — a 4,400× improvement with 99.8% OWASP coverage. Identified an unaddressed gap in API authorization observability and built the MVP for continuous auth posture monitoring. Designed a fleet management platform for distributed sensor deployments with privacy-preserving cross-tenant threat intelligence. Deep Linux systems expertise, Rust for performance-critical paths, eBPF for kernel-level visibility.",
      "vectors": { "security": "must" }
    },
    {
      "id": "profile-platform",
      "text": "Platform engineer who treats internal infrastructure as a product. Built an internal developer platform shipping $50M/year in software across 6 target platforms — self-bootstrapping reproducible builds, 600+ managed pipelines, and a task-based DSL. Post-acquisition, delivered four production platforms in 11 months including an edge protection sensor, fleet intelligence platform, and endpoint agent. Designed self-service systems that eliminated organizational bottlenecks: pipeline portals, documentation platforms, demo environments, validation suites. The pattern across every role: find the bottleneck, build the system that removes it, then hand it off.",
      "vectors": { "platform": "must", "sre": "strong" }
    },
    {
      "id": "profile-build",
      "text": "Platform engineer who treats build and release infrastructure as a product. Built an internal developer platform shipping $50M/year in software across 6 target platforms with self-bootstrapping reproducible builds, 600+ managed pipelines, and a task-based DSL. Developer tools that eliminated ~1 day/week of engineering toil, self-service pipeline portal that cut support requests 50%. Post-acquisition, delivered four production platforms in 11 months using AI-augmented development methodology with multi-LLM review gates and behavioral test gap analysis.",
      "vectors": { "build": "must" }
    },
    {
      "id": "profile-sre",
      "text": "Platform engineer focused on infrastructure reliability and operational excellence. Rearchitected sensor fleet infrastructure cutting AWS spend ~50% (~$60K/mo savings) by replacing dedicated per-customer VPCs with shared infrastructure and redesigning scaling from CPU-based to connection-based metrics. Diagnosed a kernel-level issue (conntrack table exhaustion at 150K+ RPS) enabling a $1M enterprise contract. Built fleet management tooling that reduced troubleshooting from hours to minutes and enabled self-service sensor operations. Deep Linux systems expertise across RHEL, Ubuntu, KVM, systemd, and eBPF.",
      "vectors": { "sre": "must" }
    }
  ],

  "skill_groups": [
    {
      "id": "languages",
      "label": "Languages",
      "content": "Python, C# / .NET, SQL, Bash, C++, PowerShell, TypeScript, Rust",
      "vectors": {
        "security": { "priority": "must", "order": 1, "content": "Python, Rust, C++, Bash, SQL, TypeScript, C# / .NET, PowerShell" },
        "platform": { "priority": "must", "order": 1, "content": "Python, C# / .NET, TypeScript, Bash, SQL, PowerShell, Rust, C++" },
        "sre": { "priority": "must", "order": 1, "content": "Python, Bash, SQL, C# / .NET, PowerShell, TypeScript, Rust, C++" },
        "build": { "priority": "must", "order": 1, "content": "C# / .NET, PowerShell, Python, Bash, SQL, TypeScript, Rust, C++" },
        "leadership": { "priority": "must", "order": 1 }
      }
    },
    {
      "id": "infrastructure",
      "label": "Infrastructure",
      "content": "AWS (production, Serverless), Linux (RHEL, Ubuntu, KVM, systemd, SELinux), Kubernetes/EKS, Docker, VMware, Terraform, Ansible, Helm, Flux/Kustomize",
      "vectors": {
        "security": { "priority": "must", "order": 3 },
        "platform": { "priority": "must", "order": 2 },
        "sre": { "priority": "must", "order": 2 },
        "build": { "priority": "must", "order": 3 },
        "leadership": { "priority": "must", "order": 2 }
      }
    },
    {
      "id": "networking",
      "label": "Networking",
      "content": "TCP/IP, HTTP/S, TLS/SSL, DNS, routing/switching, load balancing, Nginx, Pingora",
      "vectors": {
        "security": { "priority": "must", "order": 2 },
        "platform": { "priority": "strong", "order": 4 },
        "sre": { "priority": "must", "order": 3 },
        "build": { "priority": "optional", "order": 6 },
        "leadership": { "priority": "strong", "order": 4 }
      }
    },
    {
      "id": "data-messaging",
      "label": "Data & Messaging",
      "content": "PostgreSQL, SQL Server, MongoDB, ClickHouse, Kafka (AWS MSK), WebSocket, REST APIs",
      "vectors": {
        "security": { "priority": "strong", "order": 4 },
        "platform": { "priority": "must", "order": 3 },
        "sre": { "priority": "must", "order": 4 },
        "build": { "priority": "optional", "order": 5 },
        "leadership": { "priority": "strong", "order": 3 }
      }
    },
    {
      "id": "observability",
      "label": "Observability",
      "content": "Grafana, Prometheus, InfluxDB, ELK, Loki, PagerDuty",
      "vectors": {
        "security": { "priority": "strong", "order": 5 },
        "platform": { "priority": "strong", "order": 5 },
        "sre": { "priority": "must", "order": 5 },
        "build": { "priority": "optional", "order": 4 },
        "leadership": { "priority": "strong", "order": 5 }
      }
    },
    {
      "id": "cicd",
      "label": "CI/CD",
      "content": "GitHub Actions, GoCD, GitLab CI/CD, Jenkins",
      "vectors": {
        "security": { "priority": "strong", "order": 6 },
        "platform": { "priority": "must", "order": 6 },
        "sre": { "priority": "strong", "order": 6 },
        "build": { "priority": "must", "order": 2 },
        "leadership": { "priority": "must", "order": 6 }
      }
    }
  ],

  "roles": [
    {
      "id": "a10",
      "company": "A10 Networks",
      "subtitle": "(acquired ThreatX)",
      "title": "Senior Platform Engineer",
      "dates": "Feb 2025 – Present",
      "bullets": [
        {
          "id": "a10-synapse",
          "text": "Architected ThreatX Synapse, rebuilding the legacy SaaS-dependent WAF as a standalone edge protection sensor capable of inline blocking without cloud round-trips — opening new customer classes (air-gapped, on-prem, hybrid) and improving detection latency 4,400×. Detection and profiling run at the edge with sub-millisecond latency; sensitive data scanning executes concurrently at zero added latency. Blocking decisions use campaign correlation and statistical anomaly detection, not just static rules. 99.8% OWASP CRS coverage.",
          "vectors": { "security": "must", "platform": "must", "sre": "strong", "leadership": "strong" }
        },
        {
          "id": "a10-auth-intel",
          "text": "Identified a gap in API authorization observability — every competitor detects authorization attacks, but none provide continuous visibility into which endpoints enforce auth, which don't, and how patterns change over time. Built the authorization coverage map MVP that auto-discovers endpoint auth posture from live traffic with zero configuration. Designed the edge ML roadmap for on-device behavioral learning and autonomous anomaly detection.",